{
  "schemaVersion": "0.3.0",
  "projectId": "project.paper",
  "pageId": "page.scratch",
  "revision": 1,
  "compositions": [
    {
      "id": "composition.A",
      "label": "Consumer A",
      "rootNodeId": "node.frameA",
      "nodeIds": [
        "node.frameA",
        "node.buttonA",
        "node.arrow"
      ]
    },
    {
      "id": "composition.B",
      "label": "Consumer B",
      "rootNodeId": "node.frameB",
      "nodeIds": [
        "node.frameB",
        "node.buttonB"
      ]
    }
  ],
  "nodes": [
    {
      "id": "node.frameA",
      "label": "Scene A",
      "defaultProfileRef": {
        "sourceId": "project.defaults",
        "profileId": "defaults.frame"
      },
      "properties": {
        "sizing.width": {
          "kind": "literal",
          "valueType": "dimension",
          "value": {
            "value": 480,
            "unit": "px"
          }
        },
        "sizing.height": {
          "kind": "literal",
          "valueType": "dimension",
          "value": {
            "value": 240,
            "unit": "px"
          }
        }
      },
      "children": [
        {
          "nodeId": "node.buttonA"
        }
      ],
      "kind": "frame",
      "layout": {
        "kind": "freeform"
      },
      "clipContent": true
    },
    {
      "id": "node.buttonA",
      "label": "Button A",
      "defaultProfileRef": {
        "sourceId": "project.defaults",
        "profileId": "defaults.component-instance"
      },
      "properties": {
        "appearance.opacity": {
          "kind": "literal",
          "valueType": "number",
          "value": 0.4
        }
      },
      "children": [],
      "kind": "component-instance",
      "definitionRef": {
        "sourceId": "project.components",
        "definitionId": "definition.button",
        "version": "example-v2"
      },
      "parameterBindings": {
        "label": {
          "kind": "literal",
          "valueType": "string",
          "value": "Next"
        }
      },
      "partOverrides": [],
      "slotBindings": [
        {
          "slotId": "leading",
          "nodeIds": [
            "node.arrow"
          ]
        }
      ]
    },
    {
      "id": "node.arrow",
      "label": "Local arrow",
      "defaultProfileRef": {
        "sourceId": "project.defaults",
        "profileId": "defaults.text"
      },
      "properties": {
        "appearance.visible": {
          "kind": "literal",
          "valueType": "boolean",
          "value": false
        }
      },
      "children": [],
      "kind": "text",
      "content": "\u2192"
    },
    {
      "id": "node.frameB",
      "label": "Scene B",
      "defaultProfileRef": {
        "sourceId": "project.defaults",
        "profileId": "defaults.frame"
      },
      "properties": {
        "sizing.width": {
          "kind": "literal",
          "valueType": "dimension",
          "value": {
            "value": 480,
            "unit": "px"
          }
        },
        "sizing.height": {
          "kind": "literal",
          "valueType": "dimension",
          "value": {
            "value": 240,
            "unit": "px"
          }
        }
      },
      "children": [
        {
          "nodeId": "node.buttonB"
        }
      ],
      "kind": "frame",
      "layout": {
        "kind": "freeform"
      },
      "clipContent": true
    },
    {
      "id": "node.buttonB",
      "label": "Button B",
      "defaultProfileRef": {
        "sourceId": "project.defaults",
        "profileId": "defaults.component-instance"
      },
      "properties": {},
      "children": [],
      "kind": "component-instance",
      "definitionRef": {
        "sourceId": "project.components",
        "definitionId": "definition.button",
        "version": "example-v2"
      },
      "parameterBindings": {},
      "partOverrides": [],
      "slotBindings": []
    }
  ],
  "scenes": [
    {
      "id": "scene.A",
      "label": "Scene A",
      "compositionId": "composition.A",
      "durationTicks": 100
    },
    {
      "id": "scene.B",
      "label": "Scene B",
      "compositionId": "composition.B",
      "durationTicks": 100
    }
  ],
  "tracks": [
    {
      "id": "track.buttonX",
      "sceneId": "scene.A",
      "target": {
        "nodeId": "node.buttonA",
        "property": "transform.translation.x"
      },
      "keyframes": [
        {
          "id": "key.arrival",
          "at": {
            "kind": "binding",
            "binding": {
              "kind": "token",
              "valueType": "duration",
              "sourceId": "project.motion",
              "path": "motion.arrival"
            }
          },
          "value": {
            "kind": "token",
            "valueType": "dimension",
            "sourceId": "project.motion",
            "path": "motion.endX"
          },
          "interpolation": "linear",
          "easing": {
            "kind": "token",
            "valueType": "cubicBezier",
            "sourceId": "project.motion",
            "path": "motion.linear"
          }
        }
      ],
      "coordinateSpace": "parent",
      "composition": "replace",
      "reducedMotion": "jump-to-end"
    },
    {
      "id": "track.arrowVisible",
      "sceneId": "scene.A",
      "target": {
        "nodeId": "node.arrow",
        "property": "appearance.visible"
      },
      "keyframes": [
        {
          "id": "key.showArrow",
          "at": {
            "kind": "ticks",
            "ticks": 20
          },
          "value": {
            "kind": "literal",
            "valueType": "boolean",
            "value": true
          },
          "interpolation": "step"
        }
      ],
      "coordinateSpace": "none",
      "composition": "replace",
      "reducedMotion": "jump-to-end"
    }
  ],
  "sequences": [
    {
      "id": "sequence.study",
      "label": "Two Button consumers",
      "occurrences": [
        {
          "id": "occurrence.A",
          "sceneId": "scene.A",
          "atTicks": 0,
          "sourceInTicks": 0,
          "sourceOutTicks": 100
        },
        {
          "id": "occurrence.B",
          "sceneId": "scene.B",
          "atTicks": 100,
          "sourceInTicks": 0,
          "sourceOutTicks": 100
        }
      ],
      "transitions": [
        {
          "id": "transition.cut",
          "kind": "cut",
          "fromOccurrenceId": "occurrence.A",
          "toOccurrenceId": "occurrence.B"
        }
      ]
    }
  ],
  "annotations": []
}
